{
    "schema": 1,
    "channel": "beta",
    "generated_at": "2026-10-27T06:30:17+00:00",
    "releases": [
        {
            "version": "0.2.0",
            "channel": "stable",
            "released_at": "2026-10-27T06:28:34+00:00",
            "changelog": "First stable release with install and updates: NPO.WorkDash now installs from one signed zip on shared hosting, Cloudron or a VPS, and updates itself from the browser or the command line. It includes everything from 0.2.0-beta.1, beta.2 and beta.3 below.\n\n### Added\n\n- Update emails to Super Admins: once per new release on their channel (a daily check that never installs anything), and when an update succeeds, fails or is rolled back. The emails give the from and to versions, who started the update, how long it took, the reason for any failure, and a link to the update log. Logs live in `storage/logs/updates/` and can be read from the Updates page.\n- Install and update guides in `docs/install/` for cPanel, Plesk, DirectAdmin, Cloudron and VPS, covering upload, database, web folder, cron and the first update, with troubleshooting for permissions, 500 errors and cron using the wrong PHP. The wizard links to the right guide.\n- Compatibility workflow. It installs a signed release zip and updates it to a newer one on PHP 8.3 and 8.4 against MySQL 8.0, MariaDB 10.6 and MariaDB 10.11, in the docroot, `public_html` and subdomain layouts. A restricted-PHP job repeats this with a 30-second time limit, 256 MB of memory, and `exec`, `proc_open` and `symlink` disabled.\n- `php artisan app:update --step` runs one update step and exits, the same unit of work as one web request.",
            "size": 11726304,
            "sha256": "cd1e7293c6aeabf9f5d7a2ed95807d3a6c8068c40b2106b008393241ebd0ea5d",
            "download_url": "https://github.com/APESCIC/NPO.WorkDash/releases/download/v0.2.0/npo-workdash-0.2.0.zip",
            "signature_url": "https://github.com/APESCIC/NPO.WorkDash/releases/download/v0.2.0/npo-workdash-0.2.0.zip.sig",
            "requirements": {
                "php": "8.3.0",
                "mysql": "8.0.0",
                "mariadb": "10.6.0",
                "extensions": [
                    "ctype",
                    "curl",
                    "dom",
                    "fileinfo",
                    "filter",
                    "hash",
                    "mbstring",
                    "openssl",
                    "pcre",
                    "pdo",
                    "pdo_mysql",
                    "session",
                    "tokenizer",
                    "xml",
                    "zip"
                ]
            },
            "min_update_from": "0.1.0"
        },
        {
            "version": "0.2.0-beta.3",
            "channel": "beta",
            "released_at": "2026-10-27T06:08:29+00:00",
            "changelog": "### Added\n\n- Resumable update engine. An update is an ordered list of idempotent steps stored in the database:\n  1. pre-flight\n  2. backup\n  3. download\n  4. verify\n  5. extract\n  6. maintenance on\n  7. swap\n  8. migrate\n  9. health check\n  10. maintenance off\n  11. clean up\n\n  Each request works on one step for at most 15 seconds, so updates fit a 30-second PHP limit. A killed request or closed browser resumes from the last unfinished step, a file lock stops two updates running at once, and every step is logged to `storage/logs/updates/`.\n- Pre-update backup in pure PHP: a chunked SQL dump (no `mysqldump` needed) plus a zip of `.env` and `storage/app`, stored outside the web root. The last 3 are kept.\n- Chunked, resumable release download. The SHA-256 and Ed25519 signature are checked before extraction, and zips with `../` or absolute paths are rejected. Low disk space aborts before anything changes, and extraction runs in batches into `releases/<version>` and is checked against the manifest.\n- Release swap and rollback:\n  - On shared hosting, the swap rewrites `current.php` (temp file, then rename) and copies the new web assets. It needs neither symlinks nor `exec`.\n  - On Cloudron and VPS, the swap switches the release symlink.\n  - Rollback restores the previous release and, if migrations ran, the database backup. The previous release is kept until the next successful update.\n- Super Admin updater at **Updates**:\n  - Shows the version, channel, available release, changelog, pre-flight results, live progress and history.\n  - Starting an update or a rollback needs the password and a two-factor code again.\n  - Requests are CSRF-protected and rate limited.\n  - Updates never start on their own.\n- `php artisan app:update`, with `--check` and resume support, and `php artisan app:rollback`. They use the same engine as the web updater, exit non-zero on failure and restart a long-running queue worker.\n- `/up` health check: database, cache, writable storage, scheduler heartbeat and version. It returns JSON with 200 only when every check passes, otherwise 503. The updater leaves maintenance mode only after it passes, and rolls back automatically if it fails.\n- `App\\Support\\TenantBackfill` processes data backfills one `tenant_id` at a time in small chunks. ADR 0006 records the expand-and-contract migration rule.\n- CI runs every migration on MySQL 8.0, MariaDB 10.6 and MariaDB 10.11 with seeded multi-tenant data, then rolls back and migrates again.\n\n### Fixed\n\n- The web install wizard is off on Cloudron, where an app is reachable as soon as it is deployed. Uninstalled Cloudron apps now explain how to install with `php artisan app:install` instead.",
            "size": 11843478,
            "sha256": "213c6df8940917b2a63f5b20f88a2847ff3306a4a334f87847e6e24d9a10de17",
            "download_url": "https://github.com/APESCIC/NPO.WorkDash/releases/download/v0.2.0-beta.3/npo-workdash-0.2.0-beta.3.zip",
            "signature_url": "https://github.com/APESCIC/NPO.WorkDash/releases/download/v0.2.0-beta.3/npo-workdash-0.2.0-beta.3.zip.sig",
            "requirements": {
                "php": "8.3.0",
                "mysql": "8.0.0",
                "mariadb": "10.6.0",
                "extensions": [
                    "ctype",
                    "curl",
                    "dom",
                    "fileinfo",
                    "filter",
                    "hash",
                    "mbstring",
                    "openssl",
                    "pcre",
                    "pdo",
                    "pdo_mysql",
                    "session",
                    "tokenizer",
                    "xml",
                    "zip"
                ]
            },
            "min_update_from": "0.1.0"
        },
        {
            "version": "0.2.0-beta.2",
            "channel": "beta",
            "released_at": "2026-10-27T05:19:20+00:00",
            "changelog": "### Added\n\n- Web install wizard at `/install` for hosts with only a browser and a file manager. Its steps: welcome, server requirements, folder permissions, database (tests the connection, version and charset, and warns when the database is not empty), migrations (one per request, with a progress bar), site address and timezone, email (with an SMTP test), Super Admin, first workspace, cron and finish. Each step stays well inside a 30-second PHP limit, and refreshing the browser resumes at the current step.\n- `php artisan app:install`, with prompts or `--no-interaction` flags, running the same installer service as the wizard. On Cloudron it reads the MySQL addon variables.\n- One requirements checker shared by a standalone `check.php`, the wizard and `php artisan app:check`. It reports pass, warn or fail for PHP 8.3+, extensions, disabled functions, database version and charset, writable folders, memory, execution time, disk space, HTTPS, URL rewriting and outbound HTTPS, with cPanel, Plesk and DirectAdmin hints. MySQL below 8.0 and MariaDB below 10.6 fail.\n- Release layout in the zip:\n  - `npo-workdash/public/` is the web root (or its contents go in a fixed `public_html`, including a subdomain folder).\n  - `current.php` is the only file an update rewrites.\n  - `.env` and storage live in `shared/` and are kept across releases.\n  - A stable `artisan` proxy serves cron.\n  - Dotfiles and layout helpers are denied over HTTP.\n- Super Admins, with a `super-admin` gate and `php artisan app:super-admin <email>`. Super Admin passwords need at least 12 characters and are checked against known breaches when online. Super Admins are sent to set up two-factor authentication before using the app.\n- Workspaces table, with workspace 1 created at install. There are no default accounts or passwords.\n- The installer locks after use: a `storage/installed.lock` file plus an `installations` record. Every `/install` route returns 404, deleting the lock file alone does not reopen it, `app:install` refuses to run again, and the finish screen offers to delete the installer files.\n- Shared-hosting background jobs: with `QUEUE_RUNNER=cron` (the default outside Cloudron), the per-minute scheduler runs `queue:work --stop-when-empty`. The wizard shows the exact cron line for the detected PHP binary. Super Admins see a warning when the scheduler has not run for 10 minutes, and the new Installation page in the Super Admin area shows its status. Cloudron keeps its supervised worker.\n\n### Changed\n\n- Production databases that already have users are marked as installed, with workspace 1, by a migration, so existing installs never see the wizard.\n- The release smoke test installs the zip with Apache in the docroot, `public_html` and subdomain-folder layouts, and checks that `.env`, storage and code cannot be reached over HTTP.",
            "size": 11789698,
            "sha256": "2d4324c86df8615fe517cb5d177e64d7c13cd54907cadd87f6be0fda04ff0b97",
            "download_url": "https://github.com/APESCIC/NPO.WorkDash/releases/download/v0.2.0-beta.2/npo-workdash-0.2.0-beta.2.zip",